{"schema":"rise-and-fall/game-state-export","version":1,"exportedAt":"2026-09-08T05:26:38.375Z","gameStateZipped":"H4sIAAAAAAAAA+1dW2/bOBb+Kwvtq1mIN1381mYKTLEz02Ka7sMugkCW5MYYR87acmeDQf77QpbsUCIlkSIl0cE+tXYrf+fjuZDn8JD6y8mP+8xZwmDhrHbRPnGWfzmHh+gpdZbOQ/pfZ+Hkm216KL52F27xxyZxlqe/L5x4tyuf+I+zdBfO3lm6LwsnT/f7aJM5S+fPKE/3zsLZxfHxKcryT8nBWf77buE8baM4fUyLb5ylc0jT5N51XhaOu4AMBBRCwBrEerdPD3k/RsHiHnslCGJAkBAE1UC+b6N4I8PkhEIrKphBwUIUPGS0ThiwhCAMBBFCkBrE07b4UxIiLDEog0GFGFQbw2MwPCGGN3ioUAnhMxC+EMLXMKxK5QEDEghBAn2QkAEJhSDhYIWg02hBxtMh5+lQ4OlKSg9KDMhgNF0dClx9iBdCxtch5+tQ4OuPu2OWy5MhfgmDGZims0OBs6vCVGNGGJimw0OBw6sZGC1BKAPS9HhoxOMh4/GQ83howuMh4/GQ83go8HgVCFJCBAxE09+hwN8HQIQMRNPboa634wIDMd6OOG9HJuZ1xDg74pwdCZxdyab8EgMxGE1XRwZcPShhMAPTdHVkytUR4+qIc3UkcHVlD0GMoyPO0ZGmoyNYYngMRtPRkcDRlSIWqazLZ0Caro4Erj6ESMBgNH0dafp6ZcAhA9H0dSTwdWUIzPgh5vwQG/FDzPgh5vwQC/xwCAZmMJpOiIcvrk8hC5YQlIFoegcWeMcAy8WMe2DOPbAZ98CMe2DOPbCue5ASI2Awmu6BtZe+FUjIgDQdBAscZAAIYVyEcC5CjLgIYVyEcC5CBC6iYr6ohKAMRNN8iRnzJYz5Es58ieYyLighfAaiabxEO3GrdB4wIE3rJWaslzDWSzjrJZrhHZ4UQpmlHOWWclQ3cfNKDMhgNB2EatdowhIEMSBND6G6k0hFxGMwmtZLNa23ouEzEE3rpUZCL2WMl3LGSzVXJhWNkIFomi41YroeY7oeZ7qewHRV19VeCQMZmKb1egLrHQiDGJim/XomIrzHmK/Hma9nwnw9xnw9znw9zRz6BOEzavc5tfum1A7YQhDgK0FAVApSL2oBthAE+EoQEJWClOu+gK0DAb4QBESVoCEolEVpriGAmVIQYGtBgC8GAd1qEK5QfBalactAtyB0RglYlGYwBqKakKo9n5FCFqkZk4GoNDQMia1EAL4UAXRrEbBCoSwKZ2za5QivgvFYGM7YRBUJJRi3gvFZGM7atGsSZ5iAheHMTVSWUFuMnZUTsjicsYlqE2rVelLGAjbpBnzWDURp9wArYNNuwOfdQDvxxn6F47M4nBmIcm9VJ4UVUsAicZYgysBVkVCFFLJInC2I0vBBtsBmsIBPYYEohx1gC2wOC/gkFoiy2EEwPgvDmYIok1Xc8IIVUMACcZYgymYHAoUsEGcIoox2mMmxiRrgMzWgm6pBWsH4LAynIlG6NggmYGE4BelmbJBUMCELw6lHlLWpxbhSOR6L4/E4nu4eVdUiANnmEyjuPoHDaxvlVpi7gLUGlJYOlOH1vwsM24ICxT0ocFCCWNpA1R8C2R4UKG5CgRrZCKx28tl2AU430IxuIKsbyOsGmtENZHUDed1AM7qBrG4grxtoRjeI1Q3idYO0dUMrmNoGb8sOr05ZsNqqhuwmL6ccJFKOOh3MjhrmRw2LRk11bjsj1XbkWrbk9CpStNrXeOVEeE7EGCfCciI8JyLiNKTWDdliN0eIigipw4BaeAOC+AaEAU4F6VyiYsYNCCIcMBTiQC3GAUGQA9pR7pxus2MniD9AGIBUgOgZCNaAuLEThqBBjFANiBs6YQxSB6rFICAIQkAYhZSs4ZylsmMnCEJAGIWGIaEaEjd4WDuAB2ckXEPiKrFYe4JFVRrE6kkQWIEwsg5ZatcCKxBEViAMrQMURWqKIgJFEZGi1EgFZyhcg+I0RUSaUp2ZyBmM1MC4amYFplHOPOesrFkIpicgnJ+GmAWtmQUVmAU1ZBa0ZhZUYBbUkP/SmlVQgVVQc1ZBa1ZBBVZBRVYxDMyrGYYnMAxPO66HZyRYQ+LswtO2iwsSqiFxduFpZ034jIRrSJxdeNpxvUTya5x8ASffECe/xskXcPJNcHp5WThxtE9OZ3mKv9yvfBIHEfRAuApWgOA0AUEUr4AXJaELMcEohPfxJn++SKf42ML5Y5Odnis/ZdFj+vpp92eW7k8yyvyis3DS9TqNS1bVTyTpId5vnvLNrhgRp2IoJ+HhYfM0gNjpsQux6lNFrPqkQ6z6iTZiMfUJXq+AH1EESEwCEKxgDDxvHYcejtN4lYg0Jv2YtMYkflFJYzISCjQm/Zi0xpSJdWtsHaO1GxMCPIR8QJCLwSoMIUg8FLhBmEbe2hNoTP4xWY3J/KKKxqQk5DUm/5isxtSJ9fiYTBTIdo9RMiB6lM9dqJ0/VtzOH3UCyPk3dBxNxE7+OQV2ys7Ww07KugTsFJ6TZ6dumH26k7GwPH182qYDTLN68MLv8rkiePmsY52XH9ExTyFFhQeVKCqbaB9FKVsTUVR5UIWiup32alHG3h7TffwQZfkAU708eqHJfFMRZb7RMVjmZ3RMtoWs0qPKZJVNt5+slA2Kyao9qkpW3YglNCtli1UVIE33QyyZefqVcu3LM+val1omXfslLatu5a769EDu6hYuw13OUtu4Kz89jPsAg+/k/rJwjtkmL2oIFZtDHu3zTfb9vvj+HnKZRlur4T4qf+ZugKoedz9OpYvTkB5+3a02xSy4jraH9FL7qH47jrKb/e5wuNlu1utD9Z9eXhZC6VGn9Ey/tFB4ybEeS3jcKTzTcCceebkAYU74eJ9GeZpUZtM98kwHpB1mUxfe6xSeOQxo48iHglVgWxeDhfIjGcuxKODUhe/22dqeoB0hpy4+4covLRd0mBc+3x/rsleV7rvygZ82hzzK4mJqPGbbzeMmTws9rra7+I80+fD8rZzEnGyXnQxehXXQNhe3XPEwBfnzdsxlZ5DZdjr37XJDgwUDkmbp47NgRArIlgHBMtOmTQGkPm8SvljTciXIvIrk1AcF6ou2W0VzxqRnAgB2x1Dsd8dQancMxUHP8MMxA4m2+AR2ew/bQP5W3KcePryeAcA9s6BW9LMgfkC/ewCYM9lvk7/bzZ/tinuTA4Bx5yrQ7bN/ndljvlUgkVn7dsyZZpU+GWvayRr0LfmvVdndGX5viJ91gUT8vgUeGXOO1pe/O77UWnTfkq9RJJNn1lps33qmSXH3XEvHLLVZMNUiqmISHR5hNgzPaRLIl6/GTDYvzeojRKIabWsyT7vXF7gnF77WSO9J1QBs3bwhoUwF7Q1nQDSQSQHp/NFnLP49BkDG3L6zgL/XnQvSMUPufFHL647Vo271z8jak8mAJ7P1yTa9+uq8vVPUtfu4L6P3kZpDZjT3oJu2N3H2ORnvsJs3GnVXaT7evtuzFEU9a5nJakV3C+d79JieQJM0StA6DQAJfAgIShMQoQADHyEXpT5dJXFRTDnkUX4sBibeFczKUXvaRs/pnmlok4xU8W672ztL5+/pmhBSngXN4jRJkwuPfXrYHfdx+V6s77tt4iwpWjh/7nbJaSAPeaGg095ydMwfvh2qMQyJ661XyRokYRoCgrwIhOt1ApCPgjTAUUKCuGjaK1SfFbq7ICabQ8Hnt7Ip8MuJ2t8+OAvnIcqSm2iflMf/VI9F3S2cw/Hpafs86CcuLbR3RT9hvN1k6aDfebVH1dNqqmdT7k4jWTw1jDBThygM+Ljfp1m+fT7po/pJZ5kdt9uLE0q6zcXo8CpA1Tf9RkeCs9G5F6Nzm0a3Wq2DNfRXAFGEAAniBITQjUCaIBLQMA3iKFIwup9ajE7+ZFer0am1iLcbndpJiaFdu6onh9ptT/60n6TRSebdF6NDKKY0lTQ6iM9GRy5GB5tGl6zCYBVAAnCQ0CJ6+2AVpQhQuEpQEnkIu0jB6D62RTqFs8iqp/TaY6PiGZVhxwE6YqrScS7Fo80iK+2xuvLM+fOvu6TQWHR4zopJrHix5Od9UrTH/1t26pUMllLmfVe90fJrmh+fSknLhcUvafY9fzhZ7yb5mv7nmJ5WXH6xn707ZsmXh+hQEHk6Fho8FGN49oIPUfbHqyN4bnj2hPDVE06Tflz01f+8OeS7/fNpAVK+ZtM9/1PxI/nz6S2bX355f/Px/ttvn27be+rLpYxKulWs+f7B1IqLZd3mMT3k0eNTcXeaizzghsDFtwgtEVki+A67wb+cIoQMkPU1SWJEldTmxKK+9suzoyoXMGcZVaRrAGU4G1lWtqVZywamkfb14IGWFUwirKE4cArvk1gsRLpGMIWsROhdyiZgUNSbnz9//vrx/ub97z9VE3d5EYPqSkeVz/jSq1z7oGo4E4y9yuUHqj5qRvzfP379/Ms/Szu/f39z++nzbwNkKQ37/enHy8JJ8fmTuLW+lOH0j0/7XXKMU3BeJzkvdxPRUggtLK082n9Pc34bs4VuUKeb76PssN7tH0G+A9UUMBVhhQDVSpg5+dVCGNcJl5VENaohSxWOEe1EHmcs3OmJr3Av0SjxQkt6lcuHRgnWvdKPFe0EXuK3O4nfERXK9MCQp0wSBV+Po7TQRRPEhLHCXwslr28aWzCP1g8HQDMzYG1E0BhRUhBmxgmSqtIrXbo0fpxRHnyFbYrxY7xI+kmiJHOIsMXJoOG4MRtVAVP+roPZmQ6cC1qUR4dHSHf4o3ii4DrJavv1moiWMQ7HWEfga6svaElv2VyiPPizFxh6xf9/3JGOO9DVHkwTcYfycYe/3UZvupqPqVzd4nuapfuC1CaLd49T6m/aalu7RWs82uuCAwaTXNkiW0/6uQspmmM/dw2uX/wJCyN0zMKIAaYTF0auhVZn0aa20q4aZq6UmW+Nwowl2t6YibYlTJk3wo9WPYGQpUqvLTXRE3/2xFBz9JVa/UaZhHvlnySZEe3R8tddso6yy36k+xycDlqD4r8Yc5fRV/+d6/Ch5aH5eNUU6fYUUVEj4BXnSaxnaFPehnrrH1MN5qgVoRndwFxS0bHE6Wo5KVvOLKc7bomtRsu7trxcS/q5K/Wa0s9d0emV/o0u/GejSvpmfAPZnE1M/VHzVn2m5lomR20WgsgKpuw1wy32q98saYCrwSRr1L7Q+ajK7YIN3DKqsfKvrtKuJ/7cU7qW9HMfTeiXftoVOiJc5pGYc4Pr3MeYn5Zii4PltASpcMcEi93hJSHbNGdon8YALRNJDOprkTeQxMxGVW4Nz60X2gtzfU/KjQfuG49fP//z4/3t5/ufPt788um3j/ZN19oMZp+y9XUw/75OL4cv336/+fm9tcsmTfnt8oLg6nZltcS3y3iUB3/2dK1X/GlXNc0F2uC9Gct4mVpnz09rlKxoflqjrK0N0DK3QdBeTMZdzWwqO4R28H19G5/cZrpKEkjmYii3ua/RhmgZM2SoZ9w2WoYCpm20DAVM22gNPwDUbD6ab0TsKenWuIRX136pJf7sSaKe9HM3ivRK/3aqlHZQFTA13oAwG9NRq6r6rMxGbENnwiG1jFdgZoK1jFazq1FjRa/PzMYTtbOxEvSed+00GoiP8ytwjP6WXlY91fb59ztqDOAo129aTUDpRQyjLGb1CKhd6j9KLtFPYNq1DybmfXsYLXM9pag9ODfWDsNPeJnQo9EYHY6gx6u7clNX/pnv3NQUf/YzKf3iT9Nv/frO8vHarT1LuNIerth/M1ynuEXDAFUTaQYQ3F/QuQGrspdlC8f+rs2uEobK/qQljMsXIrbzbW4/X6FSce8he41OXBMcjZ0/bz94i7EpiqNcKDtqT5evJ//8KbIegdm70vrFv8q8xAQtA54vOHFb93zP0IRlCV/Qd8cA7rpS4ToIy3UADN49sY5Yb39Ce2vD8BtV+9tf2h811GJiQBH2dFTUyVzdVcea8s9ep9EUf+6min7xJy5C83ufSVdIIGLXaf///Cwl72qB/mCZvcXIzIuzbOA1yr7+fLwEWxG0deVE0PAk0TbVka7FklrvgnXUDLVzGuBlrjzTvkFm4kJ3S6hOchOJJVxh3yaAgcp4neooN4GP+J4pTfFn31rTHP25m5D7xbf5HrHH3THLo02WpntZbwntIDz0jrjrZTzwArXrJdzXsE0MTOkGqJq8SK19d8nEzv7VkG3Z2p/HlGe8EnAm3zW3zQ9xu/dq7CX2k7yCO0b0SVjQ9WlAE/P33vaT+PL+69f7cxe3lWIYUyly+8WwvJ29QeH63iuhS0DGpdi5ZRyD1mQhFd1aWYzlD7O9GwL0NiA1dzEVZtQZSdq6rSoxJKdwXA7F1/l8aMrOY9heYKXDy/4zkhx1x8aIV9nXs4SgnGeMvF7SE8Pc/FAXY5TXbYzYV6cp/tw7/rriW7JS6mdxPS08JshYeEx7RlpTv7naBg127vLNqEETK3nSVxvTWclbQhL19Nc2V+kqFNFsFOWSlaEttRLEJlnRaIlhblKsi3FtL97QFH/ufXnd0Z/7wLSE/BP2JXVsgxh6l+GMfOWOww3NoW3jRY21BNpAbYy7j21xvd7XIpPQ1BpkfrM0dMGzdbyomXeiGuF1Jfct2sIV9zWKG8hUsR1UJ3i5pS1UaQ9VSq6Zqlz35MD6gwFaRvZy8ARv7bSFbHmlARnzahVbqA7uqzNMdpLigJYY5rLkuhijvOpnzOOqmvLPfiuHrvzzd/r0E7jKLeL5aClda0GbS9Ch1yYiYoCwsdVZO2Gvq3qhUm6yhC/qU7ChFwHZwrf3zUfUf5OEO648hMOLOPNxbFFeb99Ra9cbDc3USQwMiZG1LOTX7fVAhuyxcyOEvb4GO6/rHv3rYNxSBzJzEt0aTYrOZ9c1adGkZOMNHjbw6rzSQmPPp5+akVM/E/TFT8Rk1PRXn8OsbQboHcbhNBRGy+LxO0wNqGGWTJ7euniJgyUJ3rlBf8prhIThqyTOFCh854X9ehirtkdvXW+J3SXG71DjTgVFMbSCA72FwRKFSzd85wZFJ91dCf4jvY226aekmCQuX325gGbH7Xbh/LnJsnR//rb4r3JjcrdwntIs2WTf2WfvysnpcFNORLcPm8PtaUCKf4kfdoc0uzlZz4fnV0H+kjOGQU4jxWVISJHSmPqU8bJw4m20eUyTD8/v44dN+iN9TLO8HKbCi8BjdMjT/bN8Fnf6YfXHyiFknpNcnDCTuCroy8IpFl3bH2ny7bSkOdQNKEnj7SZLv56WZf/aZemH55sqFv2lGoyWzkOUJVU0UzKqpZNsDsVThbzRq44ON6XiCpl/3x2zpLjZ6X/iTfX9jzUBAA=="}
