{"schema":"rise-and-fall/game-state-export","version":1,"exportedAt":"2026-09-07T21:34:42.434Z","gameStateZipped":"H4sIAAAAAAAAA+1d32/buLL+Vy50Xy2Bv0nprc0W2OLsbotteh7OQRAottIY68g5ttM9wSL/+wUl2aEk2hQlyqK796m1W2nmm/lIDofD8V/B7nmTBwnCs+BunW4WQfJXsH1In7IgCR6y/wazYLdcZVv5NZgB+cdyESTF32fBfL0un/hPkIBZsAkS8DoLdtlmky7zIAnu15tsuwtmwXo+f35K893HxTZI/n0zC55W6Tx7zOQ3QVKIuEU4eJ0FYAYVIVArBNaE/Jnuso1ZxjbLFregFIEUEUgrAg3AEZdCsCIEa4XgmpDH9XO+k3/tJgZX5iKKGKIVQ2pivq3S+bKLwUopopRCFSlUK4UOkcJLKUyRwrRSWE3K06q7vWDhFqhwGLY4DN1wGCochi0OQw2HrYDQUgZSZDRJDN2QGCokhi0SQ1ckhgqJYYvE0BGJoUJi2CIxdERiqJAYtkgMNSTuOH8VMpgUgRQOoxaHkYbDVvQSpQyoyGhSGA2chmEpAikimgxGGgb3EIEVEU3+Ig1/e4ggiogmd5GGu/aTFlKYi1rMRRrmWnMKK5zCLU5hJ5zCCqdwi1PYBaewwinc4hR2wSmscAq3OIVdcIooziAtZxAnziCKM0jLGcSFM6gCg7ZgUA0MG9rSUgRURDRR0P4o3kQwBQVroWAuUDAFBWuhYC5QcAUFb6HgLlCEamwVtoOrUBddWRGXV2KQKqY5yENd7GO9RwjV0Cdsxz6hLvixj+JCNfQJ27FPqAt+bDxDKilUldJcQUJd8GMvRY1LwnZgEg6OTHglBqliWv7XRQ5WYnAlBqtiWgTQRQ9WITYGlRyiymkxQBdC9JNDVTktDujCCCuzlSRQV+CwvQSHA9bgQoyopGBVSss5umW4j9Gw6hzcdg7WOMd2C4QqSVSV1HIP1rinrySmSmpuUSpJrL/tUBFRhkT1EWn7iPQPlRQmENVDpO0hMjQCx5UYqoppuYc4cw9R3UPa7iHO3MNVOVwvhw+dD6gKh7bh0IE74riSwlUpLTBUA8ZaCpiFam4y1CcnQzjANVVOL1QTlKE+QxkOWOGqTEWopqlacKAOji2nYSVJTVa1AMHBgKq8SKgmLVqAkDNASAWE2oCQDlBfSWoKI9TnMML+sygq97ShujVvWQ4PZzap5Kj785bdsM5u/eSom/SW1bATqxHVaqRtNaKzWp+dumI00jYaGTx69mKwKqZpMzLUZriSQlQpzfW6ktJ/w4PLtECo5gVanqFDPYNAJQapYpqeoS6mAVJJwqqkpnOozjl2A6fKpyjuoW33UJ17rAxXZYZCqopphlOVmP4bUlymVUI1r9JiAXPDAqaygLVZwJyxgKksYG0WMB0L+koiqqQmD5gbHjCVB6zNA+aEB1zlAW/zgLvhAVd5wNs84EPn6YMYrIppkoDrSNBLDFHFNBnA3TCAqwzgbQbwoQyAezFMFdPchlRi+m9DSjFC9Y1o+0YMXUMhqMQQVUzTN2Kwb1Alhqpimr4RbnwjVN+Itm+EM99wVUxzj1iJ6b9HLMXEqm/itm9inW9s52haSaKqpKZ7Yp177GICUclhqpymf2I3/olV/8Rt/8Ru/BPWtr2hZt8baje+vQ4qwtpJRWtFCLUbXxtM+4y4Ckmz8w21W19rQRCo5C4/NXbywBm95etpTVirZAPoGN5bGKsJa1VuAB3N7SdVCGuwoAYWHDyvHiSxmqQWJjh46KLg9fV1FszTzaKoEZR/ub1DDDJKYMgFFyG5B/dhfJ/hEHCxSBf4DpGY3M6Xu5eDdpaPzYI/lnnxXPkpTx+zt0/rP/NsU+jY5Y3BLMju77N5iap6xSLbzjfLp91yLS0SVAi7abh9WD71AFY8dgBWfaqAVZ+GAKtecQRYxu7QXUZASEgchyTOYHi34PPw/i4TQvD4/u4eaDzW/bGuHuvyRhuPddKw7bHuj3X1mD2w0x7rxKl8/ZguenCxfO4Abf+xwrb/OISO+3cMcZsGncVz3dHZu86ArpMPdtnj0yrr4bzqwQO+w+cK4OHzEP8dXjLEgTqINg/aQLR3ogliJ2c8Zpv5Q5rvevjx8OgBpvJNBVT5Zog3ldcM8acerN2jtmDt/WoG2809VZyZZZs+zlWefoNc+3KPuvblIC/X3jTI0cewWz/dD3sPp5/E/joLnvPlTsa5FZrtLt3slvm3W/n9LY5bAcyRKyObtHzNTQ91H9ffi/C6MOn21/XdUk6O9+lqmx3i8+rd8zS/2qy326vV8v5+W/2n19eZVnsCTmqvVhhp1e/ItNHUR+21+tgpi3v9d5vnuvqHPd8hlXLYcd6UL/lpud2l+TwrDrbvVuv5H9ni/cvXkmBBuloFRgvMN1m6yxaVAdhJ/6nZPj/oV9eea+f0Y7V07hEM8iDReDBf55nGhaWceZp/yBe/rr9nn3L5wPXLU1YILTx3c8RI9PQQhYYJ5uwjtK78aX6qxQMe8pPyk9qrxyk+ai+6zO2+MofRk9oTv5nDTvNeuefno+lP014tB/ZQe36aOGr9r4/adyEO8FR5EhvX81GXq0tYzjk22mjcVfESjESE0UjjLr6XYCRmHm2j7j4vwUYcdd1hjLRHuggjwY7T9t94RuKko41GWpsvwUYCaNLuR1qbeBi9CGhQH5rW5YnDdnEsZXrsXtq0NJ0dmmi0CIs1hM3y7PHlCGOP7YBhF4uAv49BhDBQXL0T5yHFhRLyVGfgR27cn2OVKqthWr4KnvPV8nG5y2Q2uuu8ewp1DE6iVutgfyjYpvlYvWjvYQ5I4NOHE+p1Tc8CBjeHE8xgAGI6nZkuqnRjAEFOGyAe9XjGBwOw0wZA552wz4+fdsH/A4+AGJ1MZyJvIuqbWfAtfcwKofdzTrOUi5BycRcSjO7COAMwzPgCpneLTNzdy5ltu0t3z9Is87VcnMqF72mVvmQbpVqgowfn69V6EyTB/2b3hJCydjqfZ4tsccCxybbr5828bLj5bb1aBAmSvTn/XK8XRRS73clFtkj3pM+7h6/byogxAez+bnEfLuIsDgliaRjf3y9CxJHIBE4XRMxlSYRcvnPpu4PIxXIrAf1Wllx8LrD9z/tgFjyk+eIq3SzKAmD78qybWbB9fnpavfR6iRrL38iSjflqmWe9XrUnpW1lp21J4U1hTPlUP8T7lINk8PNmk+W71Uvhj+p9QZI/r1aHQdhx3BxYh+8EumcdWUfjPenQgXS0SbqMZ3dzAkjIM5CGZHEHwxQxOYh4CvndgqDibLgr6a6OkM62XK5fGdZRunYv3z7OU7vKTetyeNvSXh1TDawrLwC8/LpeSI+l25dczieye/CnzULWgf27c0lal9nypupH/CXbPT+VKpSz9y9Z/m33UJT9LBdfsv88Z8VSFstlZv2cLz4/pFup4dOz5MNWmnNP7/dp/ocyrxKwp7g4UFzuM9K5LAz7ebndrTcvxSRf9kgG+3+S79i9FC2SP//y7urD7fXHXz4EsyDN5w/rTTvwLdcLm7Vus96lUtKXXfa0rYKn5WO23aWPT7IRBEAsBHEI8DUECSIJBlEcx/8K5NzQR1mljYT/yiq3w/1XVtm/+q+sciPef2XfWuP5r6t60+8CtH1r0nYByr613vJfWeXWvP/KKjei/VdWvZ/pv7ZKXd4FKOtwhEGjsjACAAxdFc60gjnR1c2iMLphwVlXsIHKvuUcB+uKzmNYJ0vC6CTgZ90nDFSWOlxsx5+3zrt+uZkMLmOaRZc0c9FLGmHnjb39mWdH1zU+a4rDiWEvY3gpNwP8VxZe0iz7d50LRo8M6CUtX/FZExxOWHAZjHWY7cSXNBU4HV5ff/t4ffT2hKJqx/N8Wf3wD6XuYWRVlUsM9mY9s65Iu3TZ27U8rhxZ2UEz7LmVFdrQ0N6yxYH1WVjQL37ppSo0qXr186dPXz7cXr37/afq2LxsImbbps0Wz/jaW7W+smWOG/V///Dl0y//LJly++7q+uOn33roUlLjXfHysgZLfi5bptUbh8ja4lKJ4l+fNuvF8zwL9+UAwevNmXBZUF7FtUs337JdLQBAVasaHVxSh7vbpPn2fr15DHfrsJqaegCGY4yiqmxl/FFkq71Nedj4g0in/ViDqEY2pafMMbbhE2wrIwxHZDvL6FJa0BwDDOqAyxLYAQMLjTGwNBP8SCPLVn2bSs3xR5ZO+7OMLCWzdyBau9vT2Dw7C1RgGlJFW7XJofacPo5NE2iEoGMSXO0uXidhzY4+SsdYKfBFhyW22nsW3OvUP2MQjI9OntT1Ij0Z0lADdeSApBfWoVu2dksY15OnB7DiC4dVY6bSuajjxlve3OqFkVx0jGmrvWcBvk798wYddIwEziSwzhAjTu8uc4zoOSzdAoyOxxroRFxbpqzPhdfFtG4OOJxv1ybDqpQxjrcJRypUenEB/yD1Jz9KMWo/8VlE703w9MAsI/bjeQFjVHz0UeoqpWC05ud3X75UVvwy2Ug7Zwb8xHrnKuNfw8suLY8zSPvJNyhG7c+YxoGjpnH8QKr00R4xjeMJVmzKzgkfoLoIIIkmB9L+TYQfAirXHAWPGytPDfXEEsgvGGrHXd23LM82EtUyn68fO2/aa7D4Ze92bNWfPnFnVP/vsCtgpxIyvQPUc1qzNhsx0xrDSP80u1cQj68tDI8I8ex7u1529jJF6xksGnsz8v08KZge1ygHO57BYj8oLDDG6BIXnfix1d6vxI9O+zPPAMDJrgN7hkpcNipdOmfk1JVXWNnxQNTBzt8PqG+/YHMEqYN0znCkLnYX6BxJOj+gYpNT6Y+C1JiOdJGjmwxqtwzrZMuKl5lHI6xfP/3zw+31p9ufPlz98vG3Dx5mHwdDmDw4NiL4/PX3q5/feRvcm/WXyaI9iLPwIL60LcYg7afPoRvV9/rS1KH9fZ9ZczK0prjlSIR2mWDJuYO0yZD2DdIu0699r3SeH62fyenpcY2SnPYM1oAbnM28du8EMPHLJMzRdTPfYDm6buYZLO7qGKKGC47SJWjMrcow9e1+iWqknYIZwlkWbtMNn2Ytik31gVcQj6dAObp4iLr7qHWMA4pIPMFovrAkJsXo7mDilB/7pevJNSQJoAnGUcz5ZFhdnxjuYRERAYb9cCEa52yphMoSRCMWAz+gKj+ifoSt/Xbze6yYR4gKI9avv/30qT/G00rwBMAoZubpYWQlcAShB0rEMZ1aCRqB+g/5TMd/TZ7SxRUeeg3jBBBpbwo8GepjLUwHrKITwS95Bt9DRTyK8XRQXa/Be1iER5CaZ4fJOhl2WZg6ZCNLuDRBJGJkunmoYzVSy40zR0U/nS3FEsgjzuvT2CgdSR0f65Xqc6k+4NSo/hkXnOOb9WbWy7ADKiAimFAY4Xg6iN1ytZYzkoRFIwzEcFie1LGUsFA5nnyD1TzMsoeFQAQRmgyWk6q5rrOihEsjih2MuQkPZS3QUhQxFk/PWVfFVyUunIA4IsjsRSfVV2OsbwjL6aS5ye4DodORgD6nPmhfuIeBRUQEN8JwUII1Iggi6cRqIPxre6uLKbuFI7bji8jkC0RwuEGcNAdDpmyX3TnCHiMWEQKxHxiNRyV2XS33EAmJCAI+QTy+2HG7G8UHiCJCjW3COSF2O7zrPnSb50Xdn2yewtgPekoigbDRlGNVox7UiKMY1tUYpeG264LOUn+aQBIRZtb//xl5Qibq/STs/SQZNn6KhAtupKbO2cLbeZ3RHhcWrYPa6XHxRnRUq8jZZY9Pqy7QCIoQAZ5BMxcBHiexcGIVuTWh01vFWcnnHhhFEUVmJh9vzuFggeBynaVEdNNirHUWFzs3LurcH6VreEU7x3YkVB7o0MYOerKOzaZyLtE8klzn37PNLszy7PEllP/FRF9CE0wjBM0e8+Iqr4AOABMQQYKGA3YaSv1gAZHBCSyBOKKYGZ1wOsMzyT3HAwIaQVafKEZpKj1WhoowOddhyowQpi32tucWQRFvnIBND6t/4m3ALmvY7oOwhIIIcTNDRmo8VmrBE4giQYFZi+GTxRhpeQmARhzW54qpm9rad0F5XD/nu3SZZ9nGyBwus98Cx35A7vkjW3aAKYswJ34ANhU9HanvsgEsEoAi1Cg/no7UIxWv7rEiEMWNo4tzYh2lzEvCwhFunFtPPS8571h0wMojIphnLmxWH9q7ENOIAgewfP4p2BJrLA8QkcB+YMXG1toDsZKIN07ZJm4O7/ye/wEqjwRwMAt5VU9CYnlm42R29bnL1B4rIRGiZro6KTwZKfcXyxwqjM0hnLcFQBICjSg3++FEGni4JSmQFzsENFN/1Gw0BcXGsVGpNkon/xGuFx8g8EjEzAjhzNnKYfk/ChLEIt64iOUBLFNC1AgLg4gB77zVyC3fPb+E2906t8kqK8+YjSAiRPFwIzjcVZxoyG93z3iPkcidE/cDIzBAbB79doXIWjcEJ4NorOHmPS5LUJBQWYUgjBjHXaeg3NiwxuVASzUcrNowwbJwoe7xUZqaj1IkRVECQITqfcG1+l9YiQFFCQQRaCRTp+8NLk79Ok23shAJDUWiUSwzddPs4/kLYdd444BRRDHgwzE6jQoEMdGyeb2QmdIA5AQhDL8fvTcVBq3yCw9MRW1NxU2ZMHGq0qyrrVjEkW+0oqdI0HlWICDCyMFMfo6WnoL1mhSIiChyMPG5gEhN3Xgsf7Zqj5HSiDSKvy+lGXQJARd9MjoMMic5ofbvhzuILnGxxAozhHGjy6I0UFA4RA0H1qAylqK4rsYorZ3HqtuhRbsC0MiuTd/NcGDdDqUJJq27U9PDatbQyETIn+u1MSdOaVER0Cg0nB6PsZrIDCuOEDMPIM/KqwywmDwLJy5gObydeHw9jgcXwlKeIBQRYEY87rrAZWMwwc3Dftx1gScERlDUrIEupRXpAQKOaL34XgvhzJfEehc+/q1qomlVMoeGu+/MV72OWmTIlaP+HZ9LawqZDOTUPJ7HnVZEUccBBqnhYJIVsiUbILWdGLLt2zRhalfI+wJIxIP0n+62gNRfRLzeDEKr/6WlpoXci/D6mcFZgemqQI+XEPbK3xY1dhiD4Rjd1WKdqDvrlaoRcvFpNHabDmNsKlZq5q47YqS42W50OoymEu1eWcVYFmUDQXyCeIKqzbx6V4wkgo0lVdsdaLQlFYEE0vLkapAaA1cWBGSbIcQiwWrZPaRrsOFnPquEQOKI1q/SaSFMmyh5S/x0bpHU4ZFe6aXSahRFqF400M9q7n7k7fhIH5ivQEVvf8AiUi+u0gIeddwjIsc9bYSi5+1oU6khIl7PVyHbjjbT5StKCCiOMIyNEDzLVxh5iuMI10+9fIDVq6BPAqIJZBFlvgE6UdVoBIRkeTL3DJDxAMWzpFVpSowiVu/j08+Ubg9t4hNFCIZf1toDIzTCHeZX37JxRlxyE1Q/PNTiGq1djdSCyewcZWbaOKkMcJ+TqjCwiCHz8uXlr3UfMMQRpKgbG0YLZlgCYYTq7UC0ahz9NZKhSsBE7uniiArzyPj9w5hKoH1z5ZtS9PfsOl1lHxdyVjh89fkgNH9erWbBn8s8zzb7b+V/7abMzSx4yvLFMv+mPntTzkbbq3LmuX5Ybq8Lc8h/mT+st1l+VTD4/cubIn91G1NWO07lOvqsG6Bege3rLJiv0uVjtnj/8m7+sMy+Z49ZvitRydUifEy3u2zz0n02L4ar8ljHQKGsj7MXt4diL1Gxsa3Y11kgl53V92zxtVistnWmLLL5aplnX4qF6V/rPHv/clVNfH9Zz95JsFhu5UPV9GkzaybBQ5rLTXiQvnl3e1W6XOr8+/o5X8hOuf8HHzuiIT0yAQA="}
