{"schema":"rise-and-fall/game-state-export","version":1,"exportedAt":"2026-09-07T21:09:30.722Z","gameStateZipped":"H4sIAAAAAAAAA+1dXW/bOLP+Kwc6txbB7w/fdbMFtji728W2fS/eRRGottwa68h5bad7giL//YCW7NAWKYqSIjHAuWqdWHnmGZLD4cxw9CP5mt3l75bJPFnylVoJJtKVyHhK8QqlGV+KlC9pJiiEK47zZJbcb7LH37bLPJkn37aHfZ4dklmyP2SHh30yTxbbu/tNfsiXySzJFof19/xjtsnfLffJ/K/PsyPYr3nx9fAtmdNZcnjYFckco9N3/9hkj/lOS1M8bDazZLd9KJZ/fMv2Gu3+Ybc4/neWLL5t93lxk+2W75Y/PT4/9SPhS6Vw9gWmC85RSr/AZaqWK5Wy1WolVYZXBCItZrZb3rb57u1drlELTZJJKqFcrFIoFU+phIv0C8GrVMlFzmH+RWX56vS323z3ttjeZcvkaZbc58VyXXw9EamUtcv32833fPmpWB/eLfcfv633H48K0798KNaH/c0uzw758vI3Wqnvd8t8l8z/aqePltQ+z5Iv22x31PP+W3Z/nAL5/yaz5LDe5Hv9YziD+p+1nk/6/7Nksd2WT/wnmcNZskvm8GmWHPLdLlsXyTz5Jzvku2SWbBeLh/usOJzZ32+yRX6X658k82Sf58tbqHWFDAhUg0AWiNV2l+8PfgzN4hZLDYINEFwDwcOAwBkylIWsykIXIPcb/W87DCRLbSFDW9cYyILRgUiKZviMcvxwCZOWOLjfwEMDBNYw4BAQJo86jUFYYGNAcG1A8DADQgwQUgMhPWcWxhqDGhi0hkEtGCG6QqWusKGr6+HAluEI05UodYUNXV2DEAvI3fahOLRXF6Hl1CLG1CLWqUV6Dgk2MHANA1swOlEhBgypwZChYOgsxcYMS6+HppxiKe5uIY/jz0wYVodhNpiweVZpLTUXZWpflWmnJVPSqZRmLssaCh0EhZkorI7CBkEhxiZMapsw6e5MmOqChrauIegQEHiWmqsytS/LtPvaR7yaXuaqrMEQG8zXTbZYt6ZDRGnIUnOTrK0X1HtZqkptpvGvwWAbTMjg4EprpvWvoZBBUJC5XFB9uaC+y6Wy/qnpWtRQsA0l3KNks5SZa5/Z1z7rTIZoFG6i8DoKHwSFzlJqWktqt5a096JhJhCrAzEbUBelUVNp1yjchhK+Y1LT1NC6qaE2UxPqApz2GWKq7RqJ2ZA67M3CVJyoK070VhzTMNKEkXUY2XcW0GoWEHMWXCuND6c0YirtGkfYcILZSBNF1lHkICjc3Ad4fR/gAzmBwsQRdRzRd7856UyYOhN2nYnOKMfZrEwUVUdRg6CIWcpNjXG7xnj/pclNlV3DyGFglAmj6jBqGBhh7p6ivnsK2+7ZSWnMVNo1jBwGhs9SaS5OaV+csvvpGVVKk6bSrmFEXxhEqz3tedmw+rJhtmUTzoabMLwOw/uuTl7pTJg6u0YRg6Awc9Ww+qphtlUTjMJNFF5H4YOgEBOF1FFIX5STi/aMQusotK+dwaez7bMBwHUDgPt66VWEzkAhdRQyCAo1UWgdhfY2ZrxSGTVVdu0D4r4+4Ell1FTZNQqxoYT5M6cDlDKVpuxKU53ZnI6cylz/1yjMhhLG5rQ2pam16x2A2HaAYDbURKF1FGpDCT0+neymNPV2jcQGQyLmPkDq+wDpvanBSnXCVN01DLXBdCKETCRUR0LDEMImDK7DYBtM0MwmVe7M2A9gfT+AfXcdVSmNm0q7RkE2lMBwSpWeNYBwHQgPBQTNTQHWNwXYd+s56Y2ZertGQTaU0Gl9Ohig5yBh+cnqsSHUC4xUxwMDTFrApBUsKMQOK9cNPQfyy09W5w3B/rTEBZiwgInhwOQFmLSASStYJx0qU4XXmyzvv8mepqAytXeNI2w4QX4WqU7ahuKURXHKqrjwAx2CF1DVx6sVDPuPEqrmgzKnw7X2ZG/t0Up7ylTeNYwaBkbrSl1o7hropLjuHuRZb9LU27UrJIc53CsTRtVh1DAw0HTvYd29h30PEeiUt6LmvnQNg/qfIlRVP2QEectP1gqiHmHekhE0gWAdBw6Rujjpziz4qCFZCXVCSi8ysqklJZsOlJOFJhCs40AbTAdOT09lmWm+0987bUntKhmzh8O3T/uyHDRRFPLVl+UqXapcpRTzLFWr1TLFAstckmxJ5SKZJcv1XsP9nt3pksayCvO/fjqS22x3yTz573xFKdXT/1tWLMu6Uy1aQB1pWes5C3jikOtSWl11uXjY7fLisCkrXSv8U43scr3Xf7OTUPtv6/sgmc7VsJ9nyf7h/n7z+Iz7eZYs88VmXeSdZDnNk/y4pNs/t1gfHrU4+WZ9ty50OWwyX2Wbfa6Hr1jkS+MHuqL2Ybcoa1W/bjfLZI7ELPlnu10eT8P7w7bIkzl9epqdTs1tCmMHnHVvzFlHvki84o5Z16rC2BzgVg9Uky7kEXPgOk7WgGppy8QLkdWYv47J2urv9J108DTp4HnSsaenU1n3s9HbH7LdYV18vdU/vyXaO9r+U1TzrKVF/Htd6G8fRXYmTu6234+G+Gje979tv6w3+ZlBZcyrRb7Iipvddr+/2axXq331JW3yd1kp++fz6rkUn8IL8VsuLbf4z3WsLyP9oqyur4Rnw+reiIiNIT0fVvVGLdEI0jP0EtLDkYTHL7Jo1ViLFvUQ/+z02A8NdvkPu4dL8c+e6vlocfYpXczKv/3zen/IikV+BP2y2S7+zpc/PX4qTWySbTZJm/GTAyuA+QYwNgX0Mds2BTxXiL8O/mRg/viV8Rc9+F959fbayv5qmJ2j+xaFlH/oUh/Eoo+8yO8e22iEsxeZEe7dNLIZwcWwWxob1Rfi8kV8Ifd6HlR6MbATzcaVfmhvwszrvI61o3qM3+k4b78H0ZZ/GTZtyzV5KPQht7zSXWNd6LNrm4Gnw5oM8dJH1wvp5cAHED7qouMv48CFTLlJl5zELxF3aPBchj2699ls3e4XDLcb0bhffWyJWyNGlcVr04jss8Itmwr1hXci2VT6xOQstI0K35hpSzqwPWdD2oIxDDofdtyF7/wRybj32QmeEzv2MvAxIqF9hs02b2n4uE07b/ucPJsG0L1nDesG9zm7uN3gkRwpNfAmCT1ZhDiMhhr6xC19J6/IFp0iAysAvzKro/okoIz2Z0ERu546sHnI1LUKjo+/LZa/bb/n7wv9q4+P93mZ0T/m6ducKfrMEoeSvOn116Yk1ScT4Pa3Q05ck5jQPslzmwWBryvcr/q4LZZhR9GdLj+X9U7HCp3AyrNTOWTgY72DoUVZNlZ9Wub7xW59f1hvdcllMkvy1SpflGWVx688dag8DKd29lF7n1IqeufPTQSrLwVRLJdlOMPTcu7rUFT8Th+b6J27hHYo0wwnaOxlA2yHFU3jJ01Mz18LI2tE9DrwvYgHDhNVPLG++GEjceObQdyP1jWcdGWUe4ZQKprVpyZ+x6+ciLUvsLwg1v6x3mfUjrY1pMA2nJrFtnYMIPSwrQGFuuEM67a1m6vV2baGlRCHE7Ta1sB6msFsa3Btdwe+Dtvap4RoENvavnY+nHTNtnbyl0Nt69NznflPWfH3c6k5Vax+wUG73v+siyLfmS3HW3cBX2yy9Z12qd8svq3z7+cbPD/K9ZTeZftDvntsz90YI+PhlpuStsHhkFptoU896T71Z8b7m1INuvv6n7pRfXnI0h3SP+SHh/vTnYf18kP+n4f8eDJRsmx1vy1+We8PWw3914/qJ1p/h8djV/U/fn1z8/b247tf3yanm1AhUykrFt+2u8sQsU7u7LaHTCN9OOT3+6qx6bFtPNQt3O/y/SG7u9c36iHmKVQp5B8RmRM6xxggKf6d6PPhiwpr1FJ1F5YDReEIwhqdLjsLSzCgmI8grNHCsLuwCiCmRhDWaFDXWViKAUFjzFkjzNddWAYopiMIa7SX6i6sBHiUOWt0D+osLIOAoDGERQPMWYaBQng8a3BsvNFdWgqYHMMcmJ0aukvLASNkBGlhb0vL5hACiNHrmAhsDiVQYowdd4CJwOYIA6VGXGQWW4taC0sogHxEW9vDmWHaP8BkxC231xKjChA0xqQ17kp2FpYxgEYRFg2gWaaAgiMKa9ly2y4wPocCUD6G50WdbmJ7YREFchRr8Hy1uuMs4PrMyOCILm2PKcvnWAJB2Xhnxh4HXH48M9IxNMud/jduL6wEUI24gVmMQXthqQCQj7cn9IjJcL0lSDbewaaHyyXmEAFM5Hi+t0WxbSeB0N4sIWP4h8jpcrUXFhGgRjkokN6GS8wxHMnKuqdB271W6DAiZSNa2T6HGjHHChA2nuXqNQ0IAgiPYQ3cC6z9NKACsFHONO79q72wDAHBxohxuK1BW2HlHGKgxIjToEfMU84RApQ3x7o+/f7u46WwLRNYusjuf/xNmlrLiiHgHs+7LmtLxTbLejo2tBeVAk6b58AQam3oQ0MChJVAeibsEHptuOkSICxBgNFmL2YIzVrKO88phvaySgA9qZohFOuWNWDGUgKo84hw88v79x/e3t68+fPnTopdVM3yggsSW4qv5gQC4ozZO8VvqetL8cNegd5SfAwocbm7f7798P7Xf5Vz5fbNzcd373/vPL3fHP942Ynv4fj+dXtnrFKI42/vd9vlwyJPT3UYydPn9rwIkMI1LF5eAUuhDS88IC8GsHJtRROsllMhYik98kkvAFfBa/3lFkug9BJw6NoBxl4r5HJOHXZZsV9td3fpYZtWjsQh233ND5eGWTwZk81HmBKAmWt/HnsR0UDC5yxBCGEJOHbNzxcf4Xp7TINv+cv05MvYqF6MLfZQZRQgGclkPrZhbcn1HEIN4SqAoK7I3ovP43rf0KBhha2ZUqjjghxOxtTSnTaIKg6iygATrqP59I4X8YiPMGDEtZF/+v3n993XXWsZMAYi3JmIRoWUAwmDXe/RTg4+8RkDHE62u9Y7kjZ6qLMe3u3MaQyVb0837EGzOtHR9DkPYtGdZNw6Ed0flQOqEyGgUOeD4dQ7yYXXR31UBYAyDveAofZMUThTDAHmcZicEEcI1R0hL1MMJOrMdFBPnuH2TJnFu/VSVYDRSEI4IZ48s5xafFwJBYS4Ep7THtC+5kW+02TXxWJ7dxHU8bJSDRcspndkWKP4WOedMI/XE/eJjxBgKI45xa6Mou7CcL1szmVvxgTzUpQAOcvgJ/aNbBzPRZMBHLEA0pmfGdk0eH249rQIBdRdj/Lmw4eKzoc+B0WvELyhWnbao4pt+pB6NMHHkGKA1GT5gvrrETwMLfESL0MFhLNkbGSG1M8Q1r1bH0OGAcMuCzBQSMUrAwMKd95MhtUyexktq4aSzmnnUXc7S3Q4UTprgCNOGHp5KSC7R5miOghxD1UsGi6kxXEQuuyy4D0O+RiTXrvWGPmqBsK2rJWXMAPCeWH6VQUwfEz1bWs+Wfytc1DKEn7zMqVAUteyHWjb9snAIGDKVTA1rbYb4gpeVrThRt7riuF6qXIgcbwxCNEoPtUhFOK81DOt29iYRfDxwgRAZ83/QGvbKwMHmLwC3VbVlBb//GLj8NElHHARiSlTnU4gXoYKSNE50jNRNIKEMKS6EUQkDFtHI8IYciBZHO4NbzGGlniLl6GKpugo5Jzso8UwIM66lYnPybaRO98PDuGoAOxePDzsmVm0zgjQ9hSZDnfw6TICjdHyhoQAC6KoAKWujXCCrNpV38SShPSQQApIpxWZvGLaJz1mQHYvInnRhTRoSc7n1hohAmARyb6Has7oMogLhQ13EQZy7pVPBgKkM/c8rT7dfkR64Uh41ax3I9eUmcCOnVo0txkgXjbeijso27o6xctVANXdN5os1n5qWQZDuCIIaPeiuaiuSnipYsBkLNdg+oXRfFQxASKSNHjP+LqXKW9IFkcb8fWxIhAoZ5L/t/f/env78f3tz29vfn33+9tJ/V4fESoAdtb2NxIZy/f1MlBAcud98U9/3vzyZlLf3Sc/I0BMd0Hs0rPCASFp1HiFloo5pEB1vyP1ovV+Qfcuut8xYLLzo5x0fzQgCuUdRN0+xNmYZfJzVKubqRchKT9hAZSM964WarxaS4UOBShn0H7yU4xffAWIU/3TZlW6JJG8fAkFeDqftzEDEWJyBrzX1rzpePUpAXH25YktG+DeOIL0eTkUrPuj3l0yYCB0TwNnbH+goJVfCN3DM44q0WvltszReikyCKSIxGBGOuFDtKl7a0cSSA+ILHFbZMlDVup+oaL73jNdyFBYbuZ4yWpH1tkDbeRjlmjPlZ57koVwJUChOPKqAbf3/LR0TiferkbNjTTKloGR1J7xFgVDthSKlyNFgDnDSePOPBHkV3qJcUBYHFEa0dSSynYuYTYb4iPMIODOZtL/H72ZMHrjfFQE9PXzj78A0vl6iZGtlWy/XxJLjQ5q7sGhdKSSRMJVBOSduC2+5eOKJIDOO/DTZp6afAMfLYwBhnGc9ALSTH5aEtDpyjebU6J9eOkmv93LSYbdTuu14stAMgIgZ/vG49XxUxqqV7DDJwbFQDmt2PSR38bmHAw2ZxoiCLx75RcAdY81DTulaftNRNoO0z6uGAEaSf/O3odpL1cK6HTj2hwlaTLBPl76ZRbO1/BEEeoyXhDvr6Py8xVAdQ+UjnKH18HXVkvlpasbbTiz70PF371CcCAiafkzzL1pL2MGAYaR1B3zwDiBLX/ZzPfYDRLCOG7BCRES8PESowDGcpuxWxsXL0UEAey+Oke/G2bpNuSnSICIpWw9JE/l5SWAcL5PM+aetpcrtslCBa9YggGJJLLhL6UI4SUbXuYwVa3pyVVpSwMfb8I5S54nqjQNO+PhOeKAOcMxDbWmIxf9ennoaJmTx/RvN2nstaTFlw1TaSjf1icEIYDL2K89ellQBpTzlWvT51S94vdqUTD69Vpoy6n6ODIG8HSvjmpMTrW9QuzhSOaQAOVsKj9U902vFAgBEknDC9nCIaa2N+94OXKgIul3dV2FUI+8+8gc2940Nm21R95b0WgvBkWAwODQ9WjbaWNPJ3ZsyoW6J5leNBljm/bcFsX1cqQNrxmO/m4hDuBK9VVgHMsLT/q9Z8FPlQBGX9oT9ArBgXK2fxtNCAmkjCOY06GGgQaNOsKARtK2SQZMcNGJKwPY+f7msSYXRgA63yU+mhAEYBmH5xIyw5nN5/dyFYA4e1GMpXACgYwkl/HiJoVIIKd7oV9nk9JpclEEeCTBYxlwyYHaDpY+rgz3ueMwcgGVuzOSr1LOXcTqK0ZzF6LK9rUGzaPAtEfKVYe46XiRXx8DBIFknfOcw56Rml4/Z8vrClsiu7Grmyas70HHUeIjmi7iHvK7+83lbPRRI/q8G0fxYcCLiMKGj3AA8WTVLt3fN+8lRgmAPI6F2OOCQFCpvlclHKBY7sx3TwbLpp7NwaucHws4Iinq73GzXna/DiK9r64PUSeBDUfA2Cop3O5Q09vt29ZE+VRFIZA8jlCMvzFDCC8KkLPtXkxNr7xMmATKWdwVSS1CMwehO9YiFUfqU4r2R4XGLpxM6MhHLJuZvL53ti2+57tDmhf53WOqv9KmQ7SXMcEN94Knzx419i9jUtf1kO6XzYfdZwMaCHt5IQZIJOvLcUXJvfPX6+qWYeSxPrC//JUmnxgUAeQM9E9+pQk39hJj5R1aZ3H0BMU1QeIrndeCzqKM13WjycsVYQC754cn74WiwshyQJwVpa/h6k8YXYyBQnGEDK5vqzV4Sn5aHMjurc6i6gzt5UoogN3bbwzrFYavThbGVQHW3exO1nkBWVJRXq4M9YnmxdQH20+VTvnqw6EyUd3zSdcp3PZPXidEA57Ew5lbJgBxvyB+ktr/2iWMJhK6LkzXS0HsOmvGkIjzMxAAOvNSU5Td1wehoY/ZkQKGgDrf5zJ9pwO//ALQSG71qvZvJrt0OJo5Iv2iUB5Jg5LrZlINNbEyiKO+/+nsnD+yU9U9zaFCQ/rc5pT5dIUpYN0bgw6qKxXUDu3y0dD3oiLLFQOvrggCwlkrMVDxml8IGs17R6IfMN05yFksMNaA6deTRxL4vx6wlhfu/RRlQxnUq8mhjjMnGQEIxVGk2KOo4UV76odokwPqNMkTpW7D3E6s3RWEXC5ZHElbPwcCmDPyOoqlJUzf9yLOd9JOpEhrHt/PhAKCJ/U0yPENfdjZd2IidV5lerwUtLF94esGTULoluXaxZZoQi9Eak3o4Kuzj+hEhrL9YB4pUN3NNjI7GUpBVY7S51myzBebdZF/OG56/94W+U+PN5UAP0KVOE+W671+pmIRIPzzo09P/werITPqfCgBAA=="}
